{
  "id": "20260926-endless-progress-chrome",
  "semanticId": "ui.marbleVoyage.endless.progress",
  "kind": "ui",
  "priority": "optional",
  "status": "open",
  "placeholder": {
    "type": "sf_symbol",
    "detail": "Endless wave hub uses SF icons for rest beats; fight shows foe portrait"
  },
  "keepStockIcon": true,
  "surface": "Endless progress hub (no climb map) — wave header / rest glyph",
  "brief": "Optional custom endless wave badge or rest glyph. Stock is fine; campaign owns the climb poster.",
  "aspect": "1:1",
  "relatedPaths": [
    "abbies.world.ios/abbies.world.ios/Views/World2/Plink/MarbleVoyageHostView.swift"
  ],
  "promptSeeds": [],
  "requestedBy": "cursor",
  "requestedAt": "2026-09-26T23:50:00Z",
  "sessionNote": "Filed with endless map removal.",
  "fulfillment": null
}
